{
  "project_id": "example-project",
  "project_profile_revision": "example-project-profile-v2",
  "plan_version": "1.0",
  "request_id": "11111111-1111-4111-8111-111111111111",
  "work_item_id": "EX-990",
  "run_mode": "fixture",
  "objective": "Produce one bounded evidence packet for final human review.",
  "project_context": {
    "artifact_ref": "context/manifests/CTX-EXAMPLE-0001.fixture-r1.json",
    "artifact_revision": "fixture-r1",
    "artifact_sha256": "17c3d329142e64d02ce9a9e41958d2f2edde9c9b086002e221f76a88379e9b25"
  },
  "diagnosis": {
    "problem": "The synthetic decision lacks one traceable evidence packet.",
    "controllable_bottleneck": "The available facts have not been synthesized for this decision.",
    "evidence_refs": [
      {
        "artifact_ref": "context/sections/facts/facts-fixture-r1.json",
        "artifact_revision": "facts-fixture-r1",
        "artifact_sha256": "4c5c41626516b6ec7fa9b877210077eaac18cdf06b06e8748b08f91362537134"
      }
    ],
    "assumptions": ["All inputs are synthetic fixtures."],
    "confidence": "medium"
  },
  "route_decision": {
    "selected_route_id": "research-evidence",
    "rationale": "Research is the smallest route that closes the evidence gap.",
    "alternatives": [
      {
        "route_id": "market-positioning",
        "reason_not_selected": "Positioning depends on the missing evidence synthesis."
      }
    ],
    "step_activation": []
  },
  "requested_at": "2026-09-01T01:00:00Z"
}
