{
  "project_id": "example-project",
  "project_profile_revision": "example-project-profile-v2",
  "plan_version": "1.0",
  "request_id": "22d62597-c822-45e4-8026-009c505efd6f",
  "work_item_id": "EX-1000",
  "run_mode": "fixture",
  "objective": "Create one source-traceable synthetic decision brief for human review.",
  "project_context": {
    "artifact_ref": "context/manifests/CTX-EXAMPLE-0001.fixture-r1.json",
    "artifact_revision": "fixture-r1",
    "artifact_sha256": "17c3d329142e64d02ce9a9e41958d2f2edde9c9b086002e221f76a88379e9b25"
  },
  "diagnosis": {
    "problem": "The synthetic project has alternatives but no compact decision brief.",
    "controllable_bottleneck": "Evidence and uncertainty have not been assembled into one reviewable packet.",
    "evidence_refs": [
      {
        "artifact_ref": "context/sections/facts/facts-fixture-r1.json",
        "artifact_revision": "facts-fixture-r1",
        "artifact_sha256": "4c5c41626516b6ec7fa9b877210077eaac18cdf06b06e8748b08f91362537134"
      }
    ],
    "assumptions": [
      "All facts, audiences, alternatives, metrics, and outcomes are synthetic fixtures."
    ],
    "confidence": "medium"
  },
  "route_decision": {
    "selected_route_id": "research-evidence",
    "rationale": "A bounded evidence route is sufficient and avoids premature positioning or production.",
    "alternatives": [
      {
        "route_id": "market-positioning",
        "reason_not_selected": "Positioning should consume the evidence packet rather than replace it."
      },
      {
        "route_id": "content-channel",
        "reason_not_selected": "No channel product is needed for this internal fixture decision."
      }
    ],
    "step_activation": []
  },
  "operating_contract": {
    "project_id": "example-project",
    "project_profile_revision": "example-project-profile-v2",
    "contract_version": "1.0",
    "outcome_owner": {
      "role_id": "growth-coordinator",
      "accountability": "Own the bounded synthetic decision and its measurable learning outcome."
    },
    "growth_stage": "validation",
    "decision_question": "Which bounded evidence-backed action should the synthetic fixture take next?",
    "success_signal": {
      "name": "decision-ready evidence",
      "population": "the selected synthetic fixture scope",
      "window": "this bounded run",
      "decision_rule": "Succeed only when the exact final artifact passes every required contract.",
      "source_ref": null
    },
    "guardrails": [
      {
        "name": "truth and privacy",
        "failure_condition": "A claim lacks evidence or raw personal data enters an artifact.",
        "response": "stop"
      }
    ],
    "stop_conditions": [
      "Stop after two semantic revisions or when required evidence is unavailable."
    ],
    "resource_limits": {
      "max_duration_ms": 3600000,
      "max_input_tokens": 88000,
      "max_output_tokens": 22000,
      "max_sources": 50,
      "max_variable_external_cost_eur": 0,
      "max_attempts_per_task": 2
    },
    "authority": {
      "allowed_actions": [
        "read_project",
        "write_internal_artifacts"
      ],
      "forbidden_actions": [
        "publish",
        "spend",
        "contact_people"
      ],
      "external_side_effects": false,
      "may_publish": false,
      "may_spend": false,
      "may_contact_people": false,
      "may_use_unofficial_collection": false
    },
    "data_policy": {
      "allowed_evidence_grades": [
        "authoritative",
        "verified",
        "directional"
      ],
      "raw_personal_data_stored": false,
      "redaction_required": true,
      "retention_days": 30,
      "permitted_destinations": [
        "evidence",
        "records",
        "memory",
        "staging",
        "outbox"
      ]
    },
    "proof_requirements": [
      "source_hashes",
      "professional_contract_checks",
      "governance_verdict",
      "human_exact_revision"
    ],
    "learning_contract": {
      "learning_record_required": true,
      "causal_claim_requires_experiment": true,
      "destination": "memory/records",
      "next_decision_required": true
    },
    "created_at": "2026-09-01T00:45:00Z"
  },
  "requested_at": "2026-09-01T00:45:00Z"
}
